id,id_str,created_at,user_screen_name,text,source,reply_count,retweet_count,favourite_count,retweeted,in_reply_to_status_id_str,in_reply_to_user_id_str,in_reply_to_screen_name,is_quote_status,user_name,user_id_str,user_location,user_verified,user_followers_count,user_friends_count,user_protected,user_created_at,user_description,user_favourites_count,user_statuses_count,url,media,urls,magnitude,score
1316098884737867785,1316098884737867785,Tue Oct 13 19:30:00 +0000 2020,FLBlue,We're proud to expand our partnership with @TeladocHealth to offer @Livongo's #virtual #diabetes solution to our members to help them better manage their health. Read more via @FierceHealth  ,"<a href=""https://www.sprinklr.com"" rel=""nofollow"">Sprinklr</a>",,2,,false,,,,false,Florida Blue,190752794,Florida,true,14958,3394,false,Tue Sep 14 19:11:15 +0000 2010,"Florida Blue is an independent licensee of @BCBSAssociation, helping #Floridians in their pursuit of health. Tweets monitored M-F 8 am to 5 pm ET.",21286,46335,https://twitter.com/FLBlue/status/1316098884737867785,,http://spr.ly/6012GNmja,0.9,0.3
1316098444822364160,1316098444822364160,Tue Oct 13 19:28:15 +0000 2020,LucianoZoso,#Teladoc Is A Buy On The Merger With #Livongo (NYSE:$TDOC) | Seeking Alpha#StockMarket #Telemedicine  ,"<a href=""http://twitter.com/download/iphone"" rel=""nofollow"">Twitter for iPhone</a>",,0,,false,,,,false,Luciano Zoso,2920156086,"Chandler, AZ",false,68,30,false,Sat Dec 06 04:03:58 +0000 2014,"Engineer & philosopher, curious about all aspects of life, freelance writer, would-be trade guru. Ref links: https://t.co/FxC2kgZbhl https://t.co/inxJU0SNF9 https://t.co/948OrkWh1W",1006,2559,https://twitter.com/LucianoZoso/status/1316098444822364160,,https://seekingalpha.com/article/4378825-teladoc-is-buy-on-merger-livongo,0.1,0.1
1316097131082469376,1316097131082469376,Tue Oct 13 19:23:02 +0000 2020,AlertTrade,"VOLUME RADAR: $LVGO Livongo Health, Inc.   TradeIdeas via ⟶ ","<a href=""https://dlvrit.com/"" rel=""nofollow"">dlvr.it</a>",,0,,false,,,,false,"Trade Alerts, Trade Ideas and Crypto 🇺🇸",121158213,,false,143386,148869,false,Mon Mar 08 16:14:34 +0000 2010,"🔊 Day trade alerts, swing trade alerts, trade-ideas and crypto (All alerts are delayed). 🤖 BrokeragePlus automated trading ⟶ via https://t.co/iSgAgd96yC",6286,2183071,https://twitter.com/AlertTrade/status/1316097131082469376,,"http://dlvr.it/RjXG1R,http://lddy.no/m67e",0.1,0
1316093608085336065,1316093608085336065,Tue Oct 13 19:09:02 +0000 2020,contender_dream,"@the_chart_life Has a partnertship with Livongo/Teladoc, has earnings tomorrow if I'm not wrong.","<a href=""https://mobile.twitter.com"" rel=""nofollow"">Twitter Web App</a>",,0,,false,1316093304321323010,906328017986899968,the_chart_life,false,trust no one,1204017260081405953,Area 51,false,31,144,false,Mon Dec 09 12:37:59 +0000 2019,,4571,1221,https://twitter.com/contender_dream/status/1316093608085336065,,,0,0
1316091356012580864,1316091356012580864,Tue Oct 13 19:00:05 +0000 2020,DavidLeeChoi,".@Teladoc Health’s Agreement to Acquire @Livongo Is a Blockbuster Deal in the #Telehealth Sector, But Is it Positive or Negative for Clinical Laboratories? | @dark_daily #healthcare #healthtech ","<a href=""http://www.linkedin.com/"" rel=""nofollow"">LinkedIn</a>",,0,,false,,,,false,David Choi,1100157638,"Minneapolis, MN",false,356,1183,false,Fri Jan 18 06:02:11 +0000 2013,"Missing the “travel and eat” lifestyle. Using time home to focus on self with coffee, cycling, and local eats in MN. Senior Manager at @Accenture during day.",33,7786,https://twitter.com/DavidLeeChoi/status/1316091356012580864,,https://lnkd.in/e6iXgH8,0.1,0
1316088954098077697,1316088954098077697,Tue Oct 13 18:50:33 +0000 2020,truetelehealth,Teladoc Health and Livongo's post-merger plan: one-stop healthcare ,"<a href=""https://dlvrit.com/"" rel=""nofollow"">dlvr.it</a>",,0,,false,,,,false,Truetelehealth,1244543174955032576,,false,95,671,false,Mon Mar 30 08:34:10 +0000 2020,"TrueTeleHealth is a comprehensive, easy to use, and affordable telehealth platform. It is created to improve access and delivery of virtual healthcare.",5,2534,https://twitter.com/truetelehealth/status/1316088954098077697,,http://dlvr.it/RjX98V,0.1,0.1
1316086236008779777,1316086236008779777,Tue Oct 13 18:39:45 +0000 2020,dgbartel,"Teladoc and Livongo have come together in what is considered one of the largest mergers in the digital health industry. And, as was just announced at #HLTH2020, we're the first to team up with them to provide our Florida Blue members with access to... ","<a href=""http://dynamicsignal.com/"" rel=""nofollow"">Dynamic Signal</a>",,0,,false,,,,false,Doug Bartel,1140164130,South Florida,false,1855,3957,false,Fri Feb 01 16:46:25 +0000 2013,"Proud @FLBlue Executive | Committed to Community and Health, Collaboration and Impact | Former TV News Executive | Comments are my own",10965,10494,https://twitter.com/dgbartel/status/1316086236008779777,,https://bit.ly/3k9qVYh,0.5,0.2
1316080429724655617,1316080429724655617,Tue Oct 13 18:16:40 +0000 2020,karendrost3,"Teladoc and Livongo have come together in what is considered one of the largest mergers in the digital health industry. And, as was just announced at #HLTH2020, we're the first to team up with them to provide our Florida Blue members with access to... ","<a href=""http://dynamicsignal.com/"" rel=""nofollow"">Dynamic Signal</a>",,0,,false,,,,false,Karen Drost,704774042969088000,"Jacksonville, FL",false,68,80,false,Tue Mar 01 21:03:20 +0000 2016,Loving life and especially my grandchildren.,723,196,https://twitter.com/karendrost3/status/1316080429724655617,,https://bit.ly/33W7RXD,0.5,0.2
1316080134361841664,1316080134361841664,Tue Oct 13 18:15:30 +0000 2020,trevmuchedzi,Livongo is now back to “pre-merger” price levels6 bagger in the bag Long $LVGO,"<a href=""http://twitter.com/download/iphone"" rel=""nofollow"">Twitter for iPhone</a>",,5,,false,,,,false,THE PLUTOCRAT🇿🇼🇿🇦🇦🇺,236771286,"Melbourne, Australia",false,7028,850,false,Tue Jan 11 10:07:34 +0000 2011,Investing is doing the Lord’s work.,6519,13035,https://twitter.com/trevmuchedzi/status/1316080134361841664,,,0.5,-0.5
1316079251137859585,1316079251137859585,Tue Oct 13 18:11:59 +0000 2020,MissBillable,"Teladoc and Livongo have come together in what is considered one of the largest mergers in the digital health industry. And, as was just announced at #HLTH2020, we're the first to team up with them to provide our Florida Blue members with access to... ","<a href=""http://dynamicsignal.com/"" rel=""nofollow"">Dynamic Signal</a>",,0,,false,,,,false,Cheryl Hunt,357664596,Florida,false,245,1787,false,Thu Aug 18 18:31:00 +0000 2011,Billing Specialist,4456,4300,https://twitter.com/MissBillable/status/1316079251137859585,,https://bit.ly/3nLO98J,0.5,0.2
1316073672843628544,1316073672843628544,Tue Oct 13 17:49:49 +0000 2020,fwmedtech,Digital Ten: Digital health news you need to know - PLUS titbits from #HLTH2020  #digitalhealth #virtualcare #innovation #alliances #IP #funding #healthapps #digitalsurgery.@Amwell .@TytoCare .@Teladoc .@Livongo .@AbbottNews .@omadahealth #AWS,"<a href=""https://mobile.twitter.com"" rel=""nofollow"">Twitter Web App</a>",,2,,false,,,,false,FirstWord MedTech,442068154,,false,1155,617,false,Tue Dec 20 18:27:37 +0000 2011,FirstWord MedTech supplies global news and intelligence to the Medical Technology industry. FirstWord MedTech.,122,7702,https://twitter.com/fwmedtech/status/1316073672843628544,,https://beta.firstwordmedtech.com/story/5126663,0,0
1316071699540918272,1316071699540918272,Tue Oct 13 17:41:59 +0000 2020,RooksLeAnne,Teladoc-Livongo make first combined sale to Guidewell Health | Healthcare Dive ,"<a href=""http://twitter.com/download/iphone"" rel=""nofollow"">Twitter for iPhone</a>",,1,,false,,,,false,LeAnne Rooks,2268174518,Temecula CA,false,2118,1838,false,Mon Dec 30 02:09:17 +0000 2013,"Personal Trainer with clients on Afrezza. MNKD LONG! Passion: Options trading. Currently Social Media Director, Vdex Diabetes.",59141,42518,https://twitter.com/RooksLeAnne/status/1316071699540918272,,https://www.healthcaredive.com/news/teladoc-livongo-make-first-combined-sale-to-guidewell-health/586879/,0.1,0.1
1316071446704160770,1316071446704160770,Tue Oct 13 17:40:58 +0000 2020,PerceptionHeal,"INDUSTRY NEWS.  The IBM Digital Health Pass is designed to lower infections at public places like stadiums. The Teladoc/Livongo merger is meant to connect doctors, digital tools, and data science. #healthcare #news #technology #dataanalysis ","<a href=""https://mobile.twitter.com"" rel=""nofollow"">Twitter Web App</a>",,1,,false,,,,false,Perception Health,2699281387,"Franklin, TN",false,275,306,false,Fri Aug 01 22:20:00 +0000 2014,"Follow the entire patient journey between healthcare networks, including your competition. 28 Billion clinical referral records + 7 Million more added daily.",196,394,https://twitter.com/PerceptionHeal/status/1316071446704160770,https://pbs.twimg.com/media/EkOfHu7X0AIMf7R.jpg,https://www.perceptionhealth.com/media/news/industry-news,0.5,0
1316069777501167616,1316069777501167616,Tue Oct 13 17:34:21 +0000 2020,healthcaredive,"The Florida Blue plan, which has been a Teladoc client for several years, will now offer Livongo's diabetes platform to some 50,000 members. Executives claimed more interest behind the scenes Monday at HLTH. ","<a href=""https://about.twitter.com/products/tweetdeck"" rel=""nofollow"">TweetDeck</a>",,0,,false,,,,false,Healthcare Dive,1564072062,"Washington, DC",false,11991,472,false,Tue Jul 02 20:56:22 +0000 2013,We provide business journalism and in-depth insight into the most impactful news and trends shaping healthcare. Sign up here: https://t.co/kTOhgES7Lb,753,16689,https://twitter.com/healthcaredive/status/1316069777501167616,,http://bitly.ws/aa6c,0.7,-0.1
1316068997679333377,1316068997679333377,Tue Oct 13 17:31:15 +0000 2020,Dark_Daily,"Teladoc Health’s Agreement to Acquire @Livongo is a Blockbuster Deal in the Telehealth Sector, But is it Positive or Negative for Clinical #Laboratories?   |@TeladocHealth #pathology ","<a href=""https://mobile.twitter.com"" rel=""nofollow"">Twitter Web App</a>",,0,,false,,,,false,DarkDaily.com,44482992,"Austin, Texas",false,4236,2047,false,Wed Jun 03 23:02:48 +0000 2009,"Useful business and management intelligence for laboratory managers, pathologists and diagnostic executives: clinical pathology intelligence, webinars, & more!",294,1918,https://twitter.com/Dark_Daily/status/1316068997679333377,https://pbs.twimg.com/media/EkOdP2IUYAABVq9.jpg,"http://bit.ly/teladoc-news,http://bit.ly/teladoc-news",0.3,0
1316064669874958337,1316064669874958337,Tue Oct 13 17:14:03 +0000 2020,RxInfoAcademy,Teladoc Health and Livongo's post-merger plan: one-stop healthcare  #informatics #healthcare #healthcareit #technology #healthIT #news,"<a href=""https://buffer.com"" rel=""nofollow"">Buffer</a>",,0,,false,,,,false,Pharmacy Informatics Academy,1202776180786515970,,false,70,6,false,Fri Dec 06 02:26:10 +0000 2019,The Ultimate Hub for Pharmacy Informatics,13,1629,https://twitter.com/RxInfoAcademy/status/1316064669874958337,,https://buff.ly/3nFgDRA,0,0
1316063844431781890,1316063844431781890,Tue Oct 13 17:10:46 +0000 2020,_GuideWell,We're teaming up with @Livongo and @TeladocHealth to offer our @FLBlue members new digital tools through @OnlifeHealthInc aimed at improving access to care. Read more via @hitconsultant  ,"<a href=""https://www.sprinklr.com"" rel=""nofollow"">Sprinklr</a>",,5,,false,,,,false,GuideWell,2471358253,"Jacksonville, Florida",false,3795,2548,false,Wed Apr 30 18:30:30 +0000 2014,We are a family of forward-thinking companies offering a broad range of health solutions that help people and communities achieve better health.,5345,8453,https://twitter.com/_GuideWell/status/1316063844431781890,https://pbs.twimg.com/media/EkOZF5HWAAMnUxl.jpg,http://spr.ly/6011GNYmN,0.5,0.1
1316060300739715072,1316060300739715072,Tue Oct 13 16:56:41 +0000 2020,TerraPharma1,"""Cowen analyst Charles Rhyee reiterates an Outperform rating and $262 price target on Teladoc"" 10/13/20$TDOCCowen Positive on Teladoc (TDOC) on First Cross-Sell with Livongo ","<a href=""https://mobile.twitter.com"" rel=""nofollow"">Twitter Web App</a>",,3,,false,,,,false,TerraPharma,904301360,LAX - Seattle - Vancouver BC,false,4329,45,false,Thu Oct 25 17:14:41 +0000 2012,"Bio Farmer - K.L., Former Medical Administrator, Successful Qui Tam whistleblower - multiple cases.",7041,8192,https://twitter.com/TerraPharma1/status/1316060300739715072,,https://www.streetinsider.com/Analyst+Comments/Cowen+Positive+on+Teladoc+%28TDOC%29+on+First+Cross-Sell+with+Livongo/17463008.html,0.1,0.1
1316059743530692613,1316059743530692613,Tue Oct 13 16:54:28 +0000 2020,HedgeyeHC,Livongo and GuideWell Agree to Strategic Partnership to Accelerate Care Delivery to Vulnerable Populations | FirstWord MedTech  via @fwpharma,"<a href=""https://mobile.twitter.com"" rel=""nofollow"">Twitter Web App</a>",,0,,false,,,,false,Tom Tobin,192863913,"Stamford, CT and New York City",false,6739,737,false,Mon Sep 20 11:02:59 +0000 2010,"Health Care Sector Head @Hedgeye. Health Care stock picking long/short
Not Investment Advice: Research available for subscription at https://t.co/Kr52ctazRH",106,4217,https://twitter.com/HedgeyeHC/status/1316059743530692613,,https://www.firstwordmedtech.com/node/1038075,0,0
1316054120361537536,1316054120361537536,Tue Oct 13 16:32:08 +0000 2020,investmaid,Livongo Health $lvgoUp +7.5% at $150.5First explosive move since breaking out of the bull pennant. Enjoy #investing #trading #equities #stocks ,"<a href=""http://twitter.com/download/android"" rel=""nofollow"">Twitter for Android</a>",,1,,false,,,,true,Investmaid,1164915686122151936,,false,822,6,false,Fri Aug 23 15:02:10 +0000 2019,"Smart research and analysis ⚒ Regularly sharing investment and trading opportunities  💵 Follow for inspiration, but trade at your own risk ⚠️",36,849,https://twitter.com/investmaid/status/1316054120361537536,,https://twitter.com/investmaid/status/1313433644359389188,0.9,0.4
1316053584241479685,1316053584241479685,Tue Oct 13 16:30:00 +0000 2020,JennHIStalk,HIStalk Practice News Makers: @NYSpineMedicine @HHSOCR @usawomenshealth @CentralReach @Change_HC @Fresenius @Livongo ,"<a href=""https://about.twitter.com/products/tweetdeck"" rel=""nofollow"">TweetDeck</a>",,0,,false,,,,false,JennHIStalk,2435656188,,false,5249,3138,false,Wed Apr 09 16:08:29 +0000 2014,Digital Diva at @HIStalk. Sign up for the latest healthcare IT updates for physician practices: http://t.co/JEY3r0Z4Zm,532,15812,https://twitter.com/JennHIStalk/status/1316053584241479685,,https://www.histalkpractice.com/2020/10/12/news-10-12-20/,0,0
1316050959248904193,1316050959248904193,Tue Oct 13 16:19:34 +0000 2020,Nephronline,Read about how Fresenius patients will now be managed using @Livongo 's virtual health solutions. @FMCNAnews @FreseniusKC ,"<a href=""https://mobile.twitter.com"" rel=""nofollow"">Twitter Web App</a>",,0,,false,,,,false,Nephrology News & Issues,187918342,"Thorofare, NJ",false,5125,724,false,Tue Sep 07 13:54:24 +0000 2010,"The content you need, when you need it.",370,3685,https://twitter.com/Nephronline/status/1316050959248904193,,http://bit.ly/3jQIeNo,0.6,0
1316050469442076673,1316050469442076673,Tue Oct 13 16:17:37 +0000 2020,gatorgirltb,Exciting news! Livongo is partnering with Florida Blue to offer members Livongo’s proven chronic condition management platform beginning in early 2021. This innovative partnership is a great example of how we can combine technology with the... #FlBlueLife ,"<a href=""http://dynamicsignal.com/"" rel=""nofollow"">Dynamic Signal</a>",,0,,false,,,,false,Terri,53090274,Florida,false,106,464,false,Thu Jul 02 15:17:58 +0000 2009,Live the life you love - make the journey amazing! #navymom #militarybrat #proudgigi,942,846,https://twitter.com/gatorgirltb/status/1316050469442076673,,https://bit.ly/33SAXHi,2.4,0.6
1316049555742392322,1316049555742392322,Tue Oct 13 16:13:59 +0000 2020,NYSportsGuy210,"@ColinCowherd Livongo, Teledoc, Square, Twilio, Invitae.....tech companies in all industries are surging. This is the modern day Industrial Revolution.","<a href=""https://mobile.twitter.com"" rel=""nofollow"">Twitter Web App</a>",,0,,false,1316040233914228737,52529896,ColinCowherd,false,Steve M,254680112,New York City - But rather be in L.A. or Honolulu.,false,114,146,false,Sat Feb 19 19:41:28 +0000 2011,Just try to use my brain when analyzing situations in life or otherwise. Sometimes its best to take a step back & try to see the whole picture.,6479,22897,https://twitter.com/NYSportsGuy210/status/1316049555742392322,,,0.2,0
1316045754209906689,1316045754209906689,Tue Oct 13 15:58:53 +0000 2020,dodgeblake,".@Teladoc stock is way up today on news that broke in my session with @jasongorevic and Glen Tullman at #HLTH2020: Teladoc and @Livongo announced their first big customer, @_GuideWell's Florida Blue health plan.","<a href=""https://mobile.twitter.com"" rel=""nofollow"">Twitter Web App</a>",,2,,false,,,,false,Blake Dodge,1146599930,"New York, New York",false,1229,670,false,Mon Feb 04 00:19:04 +0000 2013,Healthcare reporter at Business Insider. Tell me some things @ bdodge@businessinsider.com.,2610,677,https://twitter.com/dodgeblake/status/1316045754209906689,,,0,0
1316043034547703810,1316043034547703810,Tue Oct 13 15:48:04 +0000 2020,RebeccaMPifer,Teladoc-Livongo make first combined sale to Guidewell Health  via @healthcaredive,"<a href=""https://mobile.twitter.com"" rel=""nofollow"">Twitter Web App</a>",,0,,false,,,,false,beccs,1008804272283275264,"washington, d.c.",false,772,590,false,Mon Jun 18 20:10:56 +0000 2018,reporter on digital health + a cornucopia of other interests @healthcaredive. tips welcome; dm's open,3710,993,https://twitter.com/RebeccaMPifer/status/1316043034547703810,,https://www.healthcaredive.com/news/teladoc-livongo-make-first-combined-sale-to-guidewell-health/586879/,0.1,0.1
1316042242205855746,1316042242205855746,Tue Oct 13 15:44:56 +0000 2020,hscelebrities,Teladoc-Livongo make first combined sale to Guidewell Health ,"<a href=""http://publicize.wp.com/"" rel=""nofollow"">WordPress.com</a>",,0,,false,,,,false,maxkrish,33081747,"Hyderabad, India",false,111,165,false,Sun Apr 19 01:25:45 +0000 2009,,2,84161,https://twitter.com/hscelebrities/status/1316042242205855746,,http://www.safetyhealthnews.com/2020/10/13/teladoc-livongo-make-first-combined-sale-to-guidewell-health/,0.1,0.1
1316041075866378240,1316041075866378240,Tue Oct 13 15:40:18 +0000 2020,TheMarkCooke,@JoTrader4 And livongo to the moon,"<a href=""http://twitter.com/download/iphone"" rel=""nofollow"">Twitter for iPhone</a>",,0,,false,1316037899167494144,1232525106003365890,JoTrader4,false,Mark,513574059,,false,3465,436,false,Sat Mar 03 20:38:41 +0000 2012,Growth investor. Got my girl & my dog. Also enjoy sales and wine. Tweets are for fun and should not be taken seriously.,47625,14935,https://twitter.com/TheMarkCooke/status/1316041075866378240,,,0.2,0.2
1316038736677871616,1316038736677871616,Tue Oct 13 15:31:00 +0000 2020,MMMnews,How @Teladoc’s takeover of @Livongo may hasten the era of virtual care. ,"<a href=""https://about.twitter.com/products/tweetdeck"" rel=""nofollow"">TweetDeck</a>",,0,,false,,,,false,MM+M Magazine,44367489,"New York, NY, USA",false,11052,1106,false,Wed Jun 03 14:20:16 +0000 2009,"MM+M: the most objective, relevant, and timely source of news, analysis, and trends in pharmaceutical and healthcare marketing",5688,20376,https://twitter.com/MMMnews/status/1316038736677871616,,https://www.mmm-online.com/home/channel/how-teladocs-merger-with-livongo-may-hasten-the-era-of-virtual-care/,0.3,-0.3
1316036875912728585,1316036875912728585,Tue Oct 13 15:23:36 +0000 2020,hscelebrities,Teladoc-Livongo make first combined sale to Guidewell Health ,"<a href=""http://publicize.wp.com/"" rel=""nofollow"">WordPress.com</a>",,0,,false,,,,false,maxkrish,33081747,"Hyderabad, India",false,111,165,false,Sun Apr 19 01:25:45 +0000 2009,,2,84161,https://twitter.com/hscelebrities/status/1316036875912728585,,http://www.celebznews.com/2020/10/13/teladoc-livongo-make-first-combined-sale-to-guidewell-health/,0.1,0.1
1316034301432135680,1316034301432135680,Tue Oct 13 15:13:22 +0000 2020,FierceHealthIT,.@FLBlue is expanding its partnership with @Teladoc to add @Livongo's virtual diabetes solution for its members. ,"<a href=""https://about.twitter.com/products/tweetdeck"" rel=""nofollow"">TweetDeck</a>",,1,,false,,,,false,FierceHealthIT,109611471,"Washington, D.C.",false,44842,2344,false,Fri Jan 29 17:09:54 +0000 2010,"We deliver need-to-know news, insights and trends to healthcare executives, CIOs and IT managers l Subscribe to our free newsletter: https://t.co/rMuSbGgjTb",111,22634,https://twitter.com/FierceHealthIT/status/1316034301432135680,,https://www.fiercehealthcare.com/tech/florida-blue-first-health-plan-to-sign-for-integrated-teladoc-livongo-platform,0.3,0.3
1316034284071858176,1316034284071858176,Tue Oct 13 15:13:18 +0000 2020,FierceHealth,.@FLBlue is expanding its partnership with @Teladoc to add @Livongo's virtual diabetes solution for its members. ,"<a href=""https://about.twitter.com/products/tweetdeck"" rel=""nofollow"">TweetDeck</a>",,0,,false,,,,false,FierceHealth,14435376,"Washington, D.C.",false,53832,3211,false,Fri Apr 18 17:19:08 +0000 2008,"We deliver need-to-know healthcare news, insights and trends for industry executives. Subscribe to our newsletters: https://t.co/vvBM9GmULs",61,21424,https://twitter.com/FierceHealth/status/1316034284071858176,,https://www.fiercehealthcare.com/tech/florida-blue-first-health-plan-to-sign-for-integrated-teladoc-livongo-platform,0.3,0.3
1316030987659210752,1316030987659210752,Tue Oct 13 15:00:12 +0000 2020,tonydaopharmd,Teladoc Health and Livongo's post-merger plan: one-stop healthcare  #healthIT #healthcareIT #informatics #technology,"<a href=""https://buffer.com"" rel=""nofollow"">Buffer</a>",,0,,false,,,,false,"Tony Dao, PharmD, CPHIMS, CSSBB, LSSBB, PMC HI",1029139566823755776,"Anaheim, CA",false,2534,697,false,Mon Aug 13 22:56:07 +0000 2018,"#PharmD, #CPHIMS, #CSSBB | #Informatics/#Clinical #Pharmacist | Digital Outreach/#DigitalMarketing @OCPhA_CA | #Podcast @PharmacyITMe | RT≠Endorse",457,4840,https://twitter.com/tonydaopharmd/status/1316030987659210752,,https://buff.ly/3nFgDRA,0,0
1316030581499596800,1316030581499596800,Tue Oct 13 14:58:35 +0000 2020,OphirGottlieb,Florida Blue first health plan to sign on for integrated Teladoc-Livongo platform ,"<a href=""http://twitter.com/download/android"" rel=""nofollow"">Twitter for Android</a>",,4,,false,,,,false,Ophir Gottlieb,100024370,"Los Angeles, CA",true,86919,276,false,Mon Dec 28 19:13:21 +0000 2009,CEO @CMLviz. Contrib @Reuters. MS Stanford Math. Ex option market maker & HF manager. Recognized for AI in large scale finance. https://t.co/8ZWT4aVeb5,14549,153146,https://twitter.com/OphirGottlieb/status/1316030581499596800,,https://www.fiercehealthcare.com/tech/florida-blue-first-health-plan-to-sign-for-integrated-teladoc-livongo-platform,0,0
1316027170943168514,1316027170943168514,Tue Oct 13 14:45:02 +0000 2020,OptionAlert,"Bullish flow in Livongo Health Inc ($LVGO) today, with 7144 contracts trading and implied vol up 2.1 points to 73%. Shares near $147.62.","<a href=""http://option-alert.com"" rel=""nofollow"">user notes autopost</a>",,0,,false,,,,false,Option Alert,70498392,"New York, New York",false,25659,5358,false,Mon Aug 31 20:56:58 +0000 2009,"The original source of real-time options flow alerts and analytics. Sweeps, spreads, unusual volume, open interest analysis, and historical data.",115,9623,https://twitter.com/OptionAlert/status/1316027170943168514,,,0.8,-0.3
1316025717520437256,1316025717520437256,Tue Oct 13 14:39:16 +0000 2020,TerraPharma1,"""Execs contend there's been more client interest behind scenes..that hasn't yet been made public""Other conditions/members""Florida Blue covers ~4M members across 16 states..&amp; Guidewell, reaches some 27M people in 35 states through subsidiaries"" $TDOC","<a href=""https://mobile.twitter.com"" rel=""nofollow"">Twitter Web App</a>",,3,,false,1315977276203298816,904301360,TerraPharma1,false,TerraPharma,904301360,LAX - Seattle - Vancouver BC,false,4329,45,false,Thu Oct 25 17:14:41 +0000 2012,"Bio Farmer - K.L., Former Medical Administrator, Successful Qui Tam whistleblower - multiple cases.",7041,8192,https://twitter.com/TerraPharma1/status/1316025717520437256,,https://www.healthcaredive.com/news/teladoc-livongo-make-first-combined-sale-to-guidewell-health/586879/,0.6,-0.6
1316024278635094016,1316024278635094016,Tue Oct 13 14:33:33 +0000 2020,DunnieN,Teladoc Health and Livongo's post-merger plan: one-stop healthcare  ,"<a href=""https://dlvrit.com/"" rel=""nofollow"">dlvr.it</a>",,0,,false,,,,false,Dunnie Norman,602817308,"Plano, TX",false,753,1261,false,Fri Jun 08 14:53:36 +0000 2012,Healthcare software commercialization leader. Husband.  Father.  SpaceX fanboy.  Exomoon searcher.,46,6295,https://twitter.com/DunnieN/status/1316024278635094016,https://pbs.twimg.com/media/EkN1G33VcAwp5-e.jpg,http://dlvr.it/RjWLFz,0.1,0.1
1316017028445007881,1316017028445007881,Tue Oct 13 14:04:44 +0000 2020,HCREPORT2020,Florida Blue first health plan to sign on for integrated Teladoc-Livongo platform... ,"<a href=""http://healthcarerpt.com/"" rel=""nofollow"">AutoPostingFromHealthCare</a>",,0,,false,,,,false,HEALTHCARE REPORT,1017610177141526528,"New York, NY",false,62,34,false,Fri Jul 13 03:22:27 +0000 2018,Daily Healthcare Industry News - Sign up for HCR Morning Newsletter - https://t.co/DZAmi3kT7U,5,10506,https://twitter.com/HCREPORT2020/status/1316017028445007881,,http://bit.ly/2NaOZxi,0.1,0.1
