id,id_str,created_at,user_screen_name,text,source,reply_count,retweet_count,favourite_count,retweeted,in_reply_to_status_id_str,in_reply_to_user_id_str,in_reply_to_screen_name,is_quote_status,user_name,user_id_str,user_location,user_verified,user_followers_count,user_friends_count,user_protected,user_created_at,user_description,user_favourites_count,user_statuses_count,url,media,urls,magnitude,score
1318509506939138048,1318509506939138048,Tue Oct 20 11:08:57 +0000 2020,6PagesInc,"2/9 A wave of IPOs, mergers &amp; funding: ""We are seeing a steady parade of M&amp;A and investment activity – such as @Teladoc-@Livongo, @Amwell, @HealApp, most recently @98point6Inc, and others.""","<a href=""https://mobile.twitter.com"" rel=""nofollow"">Twitter Web App</a>",,0,,false,1318509505970237441,1127450504252911616,6PagesInc,false,6Pages,1127450504252911616,"San Francisco, CA",false,201,89,false,Sun May 12 05:48:42 +0000 2019,The source for far-reaching market shifts & what they mean. Sign up for free at https://t.co/6LwxMdWjdY to get the top 3 market shifts in your inbox every week.,9,2494,https://twitter.com/6PagesInc/status/1318509506939138048,,,0,0
1318450639320481792,1318450639320481792,Tue Oct 20 07:15:02 +0000 2020,bisuotcbb,Is It Too Late to Buy Livongo Stock? ,"<a href=""https://dlvrit.com/"" rel=""nofollow"">dlvr.it</a>",,0,,false,,,,false,Bio-Solutions Corp,1019054702,,false,909,1928,false,Tue Dec 18 05:18:31 +0000 2012,The Natural Remedy Company. Follow us on the OTC market (Symbol: BISU),1,16269,https://twitter.com/bisuotcbb/status/1318450639320481792,,http://dlvr.it/Rjy15F,0.5,-0.5
1318354340877373442,1318354340877373442,Tue Oct 20 00:52:23 +0000 2020,BestRemoteJobs1,"Livongo is looking for a remote Senior Software Engineer, Backend – Member Experience #workathome #remotework #digitalnomad #remotejobs #remoteworking #techjobs ","<a href=""https://www.bestremotejobs.co"" rel=""nofollow"">BestRemoteJobs</a>",,0,,false,,,,false,BestRemoteJobs,1208713026871779329,Remote,false,1444,0,false,Sun Dec 22 11:37:04 +0000 2019,Want to work remotely? We have all the jobs in one search @ https://t.co/AsaXgDB6P8 Want to hire top remote talent? https://t.co/t52GunDvcF,1,32704,https://twitter.com/BestRemoteJobs1/status/1318354340877373442,,https://bestremotejobs.co/jobs/remote-senior-software-engineer%2C-backend-%E2%80%93-member-experience-at-livongo-532815,0,0
1318354317531926529,1318354317531926529,Tue Oct 20 00:52:17 +0000 2020,BestRemoteJobs1,Livongo is looking for a remote Senior Global Program Manager #workathome #remotework #digitalnomad #remotejobs #remoteworking #techjobs #remote #nomad #jobs #job ,"<a href=""https://www.bestremotejobs.co"" rel=""nofollow"">BestRemoteJobs</a>",,0,,false,,,,false,BestRemoteJobs,1208713026871779329,Remote,false,1444,0,false,Sun Dec 22 11:37:04 +0000 2019,Want to work remotely? We have all the jobs in one search @ https://t.co/AsaXgDB6P8 Want to hire top remote talent? https://t.co/t52GunDvcF,1,32704,https://twitter.com/BestRemoteJobs1/status/1318354317531926529,,https://bestremotejobs.co/jobs/remote-senior-global-program-manager-at-livongo-917585,0,0
1318354293846585345,1318354293846585345,Tue Oct 20 00:52:12 +0000 2020,BestRemoteJobs1,Livongo is looking for a remote Senior Site Reliability Engineer #workathome #remotework #digitalnomad #remotejobs #remoteworking #techjobs #remote #nomad #jobs #job ,"<a href=""https://www.bestremotejobs.co"" rel=""nofollow"">BestRemoteJobs</a>",,0,,false,,,,false,BestRemoteJobs,1208713026871779329,Remote,false,1444,0,false,Sun Dec 22 11:37:04 +0000 2019,Want to work remotely? We have all the jobs in one search @ https://t.co/AsaXgDB6P8 Want to hire top remote talent? https://t.co/t52GunDvcF,1,32704,https://twitter.com/BestRemoteJobs1/status/1318354293846585345,,https://bestremotejobs.co/jobs/remote-senior-site-reliability-engineer-at-livongo-870786,0.1,-0.1
1318354270656385027,1318354270656385027,Tue Oct 20 00:52:06 +0000 2020,BestRemoteJobs1,"Livongo is looking for a remote Senior Software Engineer, Backend – Member Experience #workathome #remotework #digitalnomad #remotejobs #remoteworking #techjobs ","<a href=""https://www.bestremotejobs.co"" rel=""nofollow"">BestRemoteJobs</a>",,0,,false,,,,false,BestRemoteJobs,1208713026871779329,Remote,false,1444,0,false,Sun Dec 22 11:37:04 +0000 2019,Want to work remotely? We have all the jobs in one search @ https://t.co/AsaXgDB6P8 Want to hire top remote talent? https://t.co/t52GunDvcF,1,32704,https://twitter.com/BestRemoteJobs1/status/1318354270656385027,,https://bestremotejobs.co/jobs/remote-senior-software-engineer%2C-backend-%E2%80%93-member-experience-at-livongo-241031,0,0
1318354247184941057,1318354247184941057,Tue Oct 20 00:52:01 +0000 2020,BestRemoteJobs1,"Livongo is looking for a remote Senior Software Engineer, Data #workathome #remotework #digitalnomad #remotejobs #remoteworking #techjobs #remote #nomad #jobs #job ","<a href=""https://www.bestremotejobs.co"" rel=""nofollow"">BestRemoteJobs</a>",,0,,false,,,,false,BestRemoteJobs,1208713026871779329,Remote,false,1444,0,false,Sun Dec 22 11:37:04 +0000 2019,Want to work remotely? We have all the jobs in one search @ https://t.co/AsaXgDB6P8 Want to hire top remote talent? https://t.co/t52GunDvcF,1,32704,https://twitter.com/BestRemoteJobs1/status/1318354247184941057,,https://bestremotejobs.co/jobs/remote-senior-software-engineer%2C-data-at-livongo-433210,0,0
1318354224313487360,1318354224313487360,Tue Oct 20 00:51:55 +0000 2020,BestRemoteJobs1,Livongo is looking for a remote Site Reliability Engineer #workathome #remotework #digitalnomad #remotejobs #remoteworking #techjobs #remote #nomad #jobs #job ,"<a href=""https://www.bestremotejobs.co"" rel=""nofollow"">BestRemoteJobs</a>",,0,,false,,,,false,BestRemoteJobs,1208713026871779329,Remote,false,1444,0,false,Sun Dec 22 11:37:04 +0000 2019,Want to work remotely? We have all the jobs in one search @ https://t.co/AsaXgDB6P8 Want to hire top remote talent? https://t.co/t52GunDvcF,1,32704,https://twitter.com/BestRemoteJobs1/status/1318354224313487360,,https://bestremotejobs.co/jobs/remote-site-reliability-engineer-at-livongo-509204,0.1,-0.1
1318354201370644480,1318354201370644480,Tue Oct 20 00:51:50 +0000 2020,BestRemoteJobs1,"Livongo is looking for a remote Senior Software Engineer, Enterprise #workathome #remotework #digitalnomad #remotejobs #remoteworking #techjobs #remote #nomad #jobs #job ","<a href=""https://www.bestremotejobs.co"" rel=""nofollow"">BestRemoteJobs</a>",,0,,false,,,,false,BestRemoteJobs,1208713026871779329,Remote,false,1444,0,false,Sun Dec 22 11:37:04 +0000 2019,Want to work remotely? We have all the jobs in one search @ https://t.co/AsaXgDB6P8 Want to hire top remote talent? https://t.co/t52GunDvcF,1,32704,https://twitter.com/BestRemoteJobs1/status/1318354201370644480,,https://bestremotejobs.co/jobs/remote-senior-software-engineer%2C-enterprise-at-livongo-136506,0,0
1318354177890930689,1318354177890930689,Tue Oct 20 00:51:44 +0000 2020,BestRemoteJobs1,"Livongo is looking for a remote Solution Sales Consultant, Behavioral Health (Remote) #workathome #remotework #digitalnomad #remotejobs #remoteworking #techjobs #remote ","<a href=""https://www.bestremotejobs.co"" rel=""nofollow"">BestRemoteJobs</a>",,0,,false,,,,false,BestRemoteJobs,1208713026871779329,Remote,false,1444,0,false,Sun Dec 22 11:37:04 +0000 2019,Want to work remotely? We have all the jobs in one search @ https://t.co/AsaXgDB6P8 Want to hire top remote talent? https://t.co/t52GunDvcF,1,32704,https://twitter.com/BestRemoteJobs1/status/1318354177890930689,,https://bestremotejobs.co/jobs/remote-solution-sales-consultant%2C-behavioral-health-remote-at-livongo-721415,0,0
1318354154834808833,1318354154834808833,Tue Oct 20 00:51:39 +0000 2020,BestRemoteJobs1,"Livongo is looking for a remote Senior Software Engineer, Backend – Member Experience #workathome #remotework #digitalnomad #remotejobs #remoteworking #techjobs ","<a href=""https://www.bestremotejobs.co"" rel=""nofollow"">BestRemoteJobs</a>",,0,,false,,,,false,BestRemoteJobs,1208713026871779329,Remote,false,1444,0,false,Sun Dec 22 11:37:04 +0000 2019,Want to work remotely? We have all the jobs in one search @ https://t.co/AsaXgDB6P8 Want to hire top remote talent? https://t.co/t52GunDvcF,1,32704,https://twitter.com/BestRemoteJobs1/status/1318354154834808833,,https://bestremotejobs.co/jobs/remote-senior-software-engineer%2C-backend-%E2%80%93-member-experience-at-livongo-530667,0,0
1318341801724366849,1318341801724366849,Tue Oct 20 00:02:33 +0000 2020,stockmktgenius,"$LVGO Livongo Health, Inc. - co Top stock up 640% from low. Close: 143.31 VolvsAvg: 0.69 Liq: $168M ","<a href=""http://www.google.com"" rel=""nofollow"">StockPoster</a>",,0,,false,,,,false,Stock Market Genius,914214567152160768,"Ohio, USA",false,8461,38,false,Sat Sep 30 19:45:12 +0000 2017,AI scanner for stock market leaders. New posts Mon-Sat. Protected accounts will be blocked,4800,63196,https://twitter.com/stockmktgenius/status/1318341801724366849,,http://stockcharts.com/h-sc/ui?s=LVGO&p=D&yr=1&mn=0&dy=0&id=p14565816076,0.1,0
1318221386448576512,1318221386448576512,Mon Oct 19 16:04:04 +0000 2020,MyWallStHQ,"In a document filed on Friday, Livongo announced the date its existing shareholders can expect to be paid the special dividend arising from its merger with Teladoc.#teladoc #livongo #merger","<a href=""https://sproutsocial.com"" rel=""nofollow"">Sprout Social</a>",,0,,false,,,,false,MyWallSt,1378053337,Dublin/New York,false,5111,878,false,Wed Apr 24 21:33:33 +0000 2013,Welcome to the home of successful investing. We help you to generate unrivalled long-term stock returns. Own your financial future #MyWallSt #OwnIt.,2194,6288,https://twitter.com/MyWallStHQ/status/1318221386448576512,,https://blog.mywallst.com/livongo-announces-date-for-special-dividend-from-teladoc-merger/,0,0
1318207539406905344,1318207539406905344,Mon Oct 19 15:09:03 +0000 2020,hfincap,"@RichardMoglen JP Morgan Downgrades Livongo Health to Neutral, Raises Price Target to $150 - 10/14 - I have this consolidating and range bound in here myself.","<a href=""https://mobile.twitter.com"" rel=""nofollow"">Twitter Web App</a>",,0,,false,1318206836827430914,826247014715363328,RichardMoglen,false,H-Fin Capital Partners,1122897839724478464,,false,598,2089,false,Mon Apr 29 16:18:02 +0000 2019,"Gavin Davis, Principal, H-Fin Capital Partners; prior SVP @cbre; IB Analyst @cibc; $4B CapMkts Transaction exp., +42% '08, RTs not endorsements; never advice",29169,45630,https://twitter.com/hfincap/status/1318207539406905344,,,0.2,0.2
1318207536185704448,1318207536185704448,Mon Oct 19 15:09:02 +0000 2020,OzmosiHealth,"Teladoc and Livongo make #diabetes digital heath platform available to 50,000, after the $18.5B merger closed in September.   #healthtech #Telemedicine #MnA ","<a href=""https://buffer.com"" rel=""nofollow"">Buffer</a>",,0,,false,,,,false,Ozmosi,1055982930,"New Jersey, USA",false,402,1065,false,Wed Jan 02 20:11:00 +0000 2013,"#Pharma and #biotech competitive intelligence, data services, forecasting, clinical trials tools: https://t.co/U4H2uCel6o  https://t.co/0NIru5sfbn #BI",69,1545,https://twitter.com/OzmosiHealth/status/1318207536185704448,https://pbs.twimg.com/media/Eks2xM1W0AA7xcv.jpg,https://buff.ly/37mAfUW,0.2,0.1
1318205665991561217,1318205665991561217,Mon Oct 19 15:01:36 +0000 2020,gatorgirltb,We're proud to expand our partnership with Teladoc Health to add Livongo's virtual diabetes solution for our members. This means we're now the first health plan to offer Livongo and Teladoc's combined-care experience to help our members... #FlBlueLife ,"<a href=""http://dynamicsignal.com/"" rel=""nofollow"">Dynamic Signal</a>",,0,,false,,,,false,Terri,53090274,Florida,false,106,464,false,Thu Jul 02 15:17:58 +0000 2009,Live the life you love - make the journey amazing! #navymom #militarybrat #proudgigi,942,846,https://twitter.com/gatorgirltb/status/1318205665991561217,,https://bit.ly/2HgP8NP,1.9,0.6
1318198033599770625,1318198033599770625,Mon Oct 19 14:31:16 +0000 2020,identifycareers,@Livongo is hiring an Eligibility Manager. This is your chance to work for the leading innovator in consumer digital health solutions. If you are interested apply here. #jobsopportunities #jobseekers #careeropportunities #employment ,"<a href=""https://mobile.twitter.com"" rel=""nofollow"">Twitter Web App</a>",,1,,false,,2602253953,Livongo,false,IdentifyCareers.com,1297194973532569602,,false,44,551,false,Sat Aug 22 15:32:55 +0000 2020,"Connecting job seekers with companies that value their knowledge, skill and intersectional identities.",19,99,https://twitter.com/identifycareers/status/1318198033599770625,https://pbs.twimg.com/media/EksuAPOVkAItC7b.jpg,https://identifycareers.com/jobs/eligibility-manager/,0.9,0.1
1318192345079304193,1318192345079304193,Mon Oct 19 14:08:40 +0000 2020,Jayunk12,$LVGO  Livongo signs strategic partnership in care delivery  ,"<a href=""http://twitter.com/download/iphone"" rel=""nofollow"">Twitter for iPhone</a>",,0,,false,,,,false,𝐽𝑜𝑛𝑎ℎ𝟛/𝟞\𝟡,2821334828,"S Houston, TX",false,298,840,false,Sat Sep 20 07:35:43 +0000 2014,"•𝑆𝐴𝑉𝐸𝐷• /Awakened Feb 2019\ +Full time investor since 2017+ -Died in 2015- Lived in Tripoli, Libya 2008-2010 |#BTC BagHolder| ~ ʜᴄɪ ᴄ6ᴢ06 ~ Dane Dad 🐾",8611,9890,https://twitter.com/Jayunk12/status/1318192345079304193,,"https://seekingalpha.com/news/3622953-livongo-signs-strategic-partnership-in-care-delivery?source=tweet,https://seekingalpha.com/news/3622953-livongo-signs-strategic-partnership-in-care-delivery",0.3,0.3
1318178844344340482,1318178844344340482,Mon Oct 19 13:15:01 +0000 2020,Growth_android,BRAND-NEW #android #app : Livongo - Apps on Google Play | Livongo makes it easy to be he... ,"<a href=""http://growthapps.sunnyday.jp/"" rel=""nofollow"">BRAND-NEW APPS</a>",,0,,false,,,,false,BRAND-NEW APPS,582418088,,false,1893,768,false,Thu May 17 03:55:13 +0000 2012,BRAND-NEW APPS on Google Play. What's New in Android Apps. Displayed in the timeline.,1,56959,https://twitter.com/Growth_android/status/1318178844344340482,,http://market.android.com/details?id=com.livongo.lvmobility,0.6,0.6
1318177659268993025,1318177659268993025,Mon Oct 19 13:10:19 +0000 2020,dgbartel,Guidewell | Livongo Signs Strategic Partnership with GuideWell Accelerating Care Delivery to Vulnerable Populations #GuideWellNow ,"<a href=""http://dynamicsignal.com/"" rel=""nofollow"">Dynamic Signal</a>",,0,,false,,,,false,Doug Bartel,1140164130,South Florida,false,1855,3957,false,Fri Feb 01 16:46:25 +0000 2013,"Proud @FLBlue Executive | Committed to Community and Health, Collaboration and Impact | Former TV News Executive | Comments are my own",10965,10494,https://twitter.com/dgbartel/status/1318177659268993025,,https://bit.ly/2IKgpZz,0,0
1318177560572825601,1318177560572825601,Mon Oct 19 13:09:55 +0000 2020,dgbartel,"Telehealth became a necessity during #COVID19 but has now become a health care delivery model of choice. That's why we're proud to team up industry-leading companies, like Teladoc Health and Livongo, to help us meet our members' changing needs through... ","<a href=""http://dynamicsignal.com/"" rel=""nofollow"">Dynamic Signal</a>",,0,,false,,,,false,Doug Bartel,1140164130,South Florida,false,1855,3957,false,Fri Feb 01 16:46:25 +0000 2013,"Proud @FLBlue Executive | Committed to Community and Health, Collaboration and Impact | Former TV News Executive | Comments are my own",10965,10494,https://twitter.com/dgbartel/status/1318177560572825601,,https://bit.ly/37iTiPR,1.4,0.7
1318176893108060161,1318176893108060161,Mon Oct 19 13:07:16 +0000 2020,SwigerDorrinda,"Telehealth became a necessity during #COVID19 but has now become a health care delivery model of choice. That's why we're proud to team up industry-leading companies, like Teladoc Health and Livongo, to help us meet our members' changing needs through... ","<a href=""http://dynamicsignal.com/"" rel=""nofollow"">Dynamic Signal</a>",,0,,false,,,,false,Dorrinda Swiger,719979823930679298,"Florida, USA",false,65,109,false,Tue Apr 12 20:05:41 +0000 2016,,6,194,https://twitter.com/SwigerDorrinda/status/1318176893108060161,,https://bit.ly/2FH5crz,1.4,0.7
1318176811973406720,1318176811973406720,Mon Oct 19 13:06:57 +0000 2020,SwigerDorrinda,Guidewell | Livongo Signs Strategic Partnership with GuideWell Accelerating Care Delivery to Vulnerable Populations #GuideWellNow ,"<a href=""http://dynamicsignal.com/"" rel=""nofollow"">Dynamic Signal</a>",,0,,false,,,,false,Dorrinda Swiger,719979823930679298,"Florida, USA",false,65,109,false,Tue Apr 12 20:05:41 +0000 2016,,6,194,https://twitter.com/SwigerDorrinda/status/1318176811973406720,,https://bit.ly/37jLIoc,0,0
1318176772781797377,1318176772781797377,Mon Oct 19 13:06:47 +0000 2020,SwigerDorrinda,"Telehealth became a necessity during #COVID19 but has now become a health care delivery model of choice. That's why we're proud to team up industry-leading companies, like Teladoc Health and Livongo, to help us meet our members' changing needs through... ","<a href=""http://dynamicsignal.com/"" rel=""nofollow"">Dynamic Signal</a>",,0,,false,,,,false,Dorrinda Swiger,719979823930679298,"Florida, USA",false,65,109,false,Tue Apr 12 20:05:41 +0000 2016,,6,194,https://twitter.com/SwigerDorrinda/status/1318176772781797377,,https://bit.ly/3o8jl26,1.4,0.7
1318171057501724673,1318171057501724673,Mon Oct 19 12:44:05 +0000 2020,anjalilawoffice,Working together....First joint sales contract for two  #telemedicine companies. #healthcare #telehealth ,"<a href=""http://www.linkedin.com/"" rel=""nofollow"">LinkedIn</a>",,0,,false,,,,false,Anjali 👑,566973108,Everywhere ,false,2002,2967,false,Mon Apr 30 03:57:27 +0000 2012,#Attorney #Entrepreneur #HoneyBadger #Telelawyer #Healthcare #Telemedicine #Fashion & #Humor. I don’t endorse anything & I’m funny. https://t.co/BLxVLrYo3y,38778,22043,https://twitter.com/anjalilawoffice/status/1318171057501724673,,https://lnkd.in/ec5zWNg,0.3,0
1318145917925588994,1318145917925588994,Mon Oct 19 11:04:11 +0000 2020,OrthoPublisher,"Teladoc, Livongo land first joint contract - MedCity News#OrthoTwitter #MedTwitter #MedEd","<a href=""https://automate.io"" rel=""nofollow"">Automate.io</a>",,0,,false,,,,false,Orthopaedics Publishers Feed,1238172853033488387,Look here 👉,false,500,215,false,Thu Mar 12 18:39:54 +0000 2020,#Orthopaedic news from major publishers consolidated for a more streamlined industry news experience.💀🗞,384,2617,https://twitter.com/OrthoPublisher/status/1318145917925588994,,https://medcitynews.com/2020/10/teladoc-livongo-land-first-joint-contract/,0,0
1318131546013028352,1318131546013028352,Mon Oct 19 10:07:04 +0000 2020,fintel_io,$LVGO / Livongo Health files form 425 Merger Prospectus ,"<a href=""http://fintel.io"" rel=""nofollow"">Fintel.io</a>",,0,,false,,,,false,Fintel.io,4312114277,,false,2362,178,false,Sat Nov 28 23:40:12 +0000 2015,"Fintel aggregates over 120 financial news providers from around the world, including activist investor filings. @risenhoover",6,276919,https://twitter.com/fintel_io/status/1318131546013028352,,https://fintel.io/sf/us/lvgo?utm_source=Twitter&utm_medium=Social&utm_campaign=filing,0.1,0.1
1318042644908367879,1318042644908367879,Mon Oct 19 04:13:49 +0000 2020,CWPatterson51,President and CEO Pat Geraghty: GuideWell Teams up with Livongo #GuideWellNow ,"<a href=""http://dynamicsignal.com/"" rel=""nofollow"">Dynamic Signal</a>",,0,,false,,,,false,Clayton W Patterson,867949058597552128,"Florida, USA",false,25,49,false,Fri May 26 03:42:36 +0000 2017,"Retired Navy Veteran,  Florida native, Single parent, Security Professional, Bachelor of Applied science in Public Safety Mangmnt, power walker, jogger, cyclist",1279,13897,https://twitter.com/CWPatterson51/status/1318042644908367879,,https://bit.ly/3kaXh4T,0.2,-0.2
1318042404025298945,1318042404025298945,Mon Oct 19 04:12:51 +0000 2020,CWPatterson51,Guidewell | Livongo Signs Strategic Partnership with GuideWell Accelerating Care Delivery to Vulnerable Populations #GuideWellNow ,"<a href=""http://dynamicsignal.com/"" rel=""nofollow"">Dynamic Signal</a>",,0,,false,,,,false,Clayton W Patterson,867949058597552128,"Florida, USA",false,25,49,false,Fri May 26 03:42:36 +0000 2017,"Retired Navy Veteran,  Florida native, Single parent, Security Professional, Bachelor of Applied science in Public Safety Mangmnt, power walker, jogger, cyclist",1279,13897,https://twitter.com/CWPatterson51/status/1318042404025298945,,https://bit.ly/34au4kY,0,0
1318042258977951744,1318042258977951744,Mon Oct 19 04:12:17 +0000 2020,CWPatterson51,"Telehealth became a necessity during #COVID19 but has now become a health care delivery model of choice. That's why we're proud to team up industry-leading companies, like Teladoc Health and Livongo, to help us meet our members' changing needs through... ","<a href=""http://dynamicsignal.com/"" rel=""nofollow"">Dynamic Signal</a>",,0,,false,,,,false,Clayton W Patterson,867949058597552128,"Florida, USA",false,25,49,false,Fri May 26 03:42:36 +0000 2017,"Retired Navy Veteran,  Florida native, Single parent, Security Professional, Bachelor of Applied science in Public Safety Mangmnt, power walker, jogger, cyclist",1279,13897,https://twitter.com/CWPatterson51/status/1318042258977951744,,https://bit.ly/3kcVBHN,1.4,0.7
1318042043596238849,1318042043596238849,Mon Oct 19 04:11:25 +0000 2020,CWPatterson51,Guidewell | Livongo Signs Strategic Partnership with GuideWell Accelerating Care Delivery to Vulnerable Populations #GuideWellNow ,"<a href=""http://dynamicsignal.com/"" rel=""nofollow"">Dynamic Signal</a>",,0,,false,,,,false,Clayton W Patterson,867949058597552128,"Florida, USA",false,25,49,false,Fri May 26 03:42:36 +0000 2017,"Retired Navy Veteran,  Florida native, Single parent, Security Professional, Bachelor of Applied science in Public Safety Mangmnt, power walker, jogger, cyclist",1279,13897,https://twitter.com/CWPatterson51/status/1318042043596238849,,https://bit.ly/35fjMPC,0,0
1318041969541541889,1318041969541541889,Mon Oct 19 04:11:08 +0000 2020,CWPatterson51,"Telehealth became a necessity during #COVID19 but has now become a health care delivery model of choice. That's why we're proud to team up industry-leading companies, like Teladoc Health and Livongo, to help us meet our members' changing needs through... ","<a href=""http://dynamicsignal.com/"" rel=""nofollow"">Dynamic Signal</a>",,0,,false,,,,false,Clayton W Patterson,867949058597552128,"Florida, USA",false,25,49,false,Fri May 26 03:42:36 +0000 2017,"Retired Navy Veteran,  Florida native, Single parent, Security Professional, Bachelor of Applied science in Public Safety Mangmnt, power walker, jogger, cyclist",1279,13897,https://twitter.com/CWPatterson51/status/1318041969541541889,,https://bit.ly/31kBjoo,1.4,0.7
1317976980684476416,1317976980684476416,Sun Oct 18 23:52:53 +0000 2020,BoogDmc,$TDOC $LVGO (long both pre merger)Florida Blue first health plan to sign on for integrated Teladoc-Livongo platform ,"<a href=""https://mobile.twitter.com"" rel=""nofollow"">Twitter Web App</a>",,0,,false,,,,false,Maximum Elevation,318577205,America,false,432,818,false,Thu Jun 16 18:12:52 +0000 2011,Full time swing trader seeking secular growth with sustaining moats,15036,4568,https://twitter.com/BoogDmc/status/1317976980684476416,,https://www.fiercehealthcare.com/tech/florida-blue-first-health-plan-to-sign-for-integrated-teladoc-livongo-platform,0,0
1317889436970110981,1317889436970110981,Sun Oct 18 18:05:01 +0000 2020,HealthITNews,"Livongo's chronic care management strategy, combined with Teladoc's telehealth network, can allow for health needs to be met on a long-term basis, said @Teladoc and @Livongo execs. #Telehealth ","<a href=""https://sproutsocial.com"" rel=""nofollow"">Sprout Social</a>",,4,,false,,,,false,Healthcare IT News,17154954,United States,false,119970,2847,false,Tue Nov 04 13:09:35 +0000 2008,"Covering the people, policy and tech driving next-gen healthcare in the U.S. It has been the voice of health IT for 15+ years. Updates via @digital_maren ^MH",3244,48237,https://twitter.com/HealthITNews/status/1317889436970110981,,https://bit.ly/37l0YB4,0.7,0.3
1317839240152141824,1317839240152141824,Sun Oct 18 14:45:33 +0000 2020,Sriram_81,"@richard_chu97 @jotaechague Amwl valuation is ridiculous, when Tdoc is the leader.  Livongo will Kill this ER, just want tdoc to bring it's fair share to the table. Zane was good CEO though , couple good hands down!","<a href=""https://mobile.twitter.com"" rel=""nofollow"">Twitter Web App</a>",,0,,false,1317173506581344258,1172960306,richard_chu97,false,Sriram,1234593562395889669,"Boston,MA",false,121,96,false,Mon Mar 02 21:37:05 +0000 2020,"Technology Consultant in Healthcare, Cricket enthusiast, interested in financial markets",479,315,https://twitter.com/Sriram_81/status/1317839240152141824,,,1.8,-0.3
1317738286367055872,1317738286367055872,Sun Oct 18 08:04:24 +0000 2020,itshartmutson,The great story goes on! ‚Livongo signs strategic partnership in care delivery‘ ,"<a href=""http://twitter.com/download/iphone"" rel=""nofollow"">Twitter for iPhone</a>",,0,,false,,,,false,The Hartmutson Portfolio,1195750246527258627,Frankfurt am Main,false,6,33,false,Sat Nov 16 17:07:39 +0000 2019,"Ein Portfolio mit einer regelbasierten High-Growth & Value Investment Strategie, mit dem Ziel im Laufe der Zeit hohe und beständige Erträge zu erzielen.",30,7,https://twitter.com/itshartmutson/status/1317738286367055872,,https://seekingalpha.com/news/3622953-livongo-signs-strategic-partnership-in-care-delivery,1.2,0.6
